{
  "event_id": "witness:event-green-001",
  "case_id": "case-fictional-northbridge-001",
  "proposal_id": "prop-green-001",
  "proposal_digest": "aaaaaaaaaaaaaaaaaaaaaaaaaaaaaaaaaaaaaaaaaaaaaaaaaaaaaaaaaaaaaaaa",
  "approval_id": null,
  "action_class": "GREEN",
  "action_state": "SUCCEEDED",
  "business_outcome_state": "OBSERVED",
  "approver_identity": null,
  "requested_at": "2026-08-30T12:00:01Z",
  "executed_at": "2026-08-30T12:00:02Z",
  "target_system": "public_web",
  "target_entity": "https://example.invalid/northbridge-civic-trust/programmes",
  "information_disclosed": [],
  "external_reference": null,
  "error_or_variance": null,
  "rollback_state": null,
  "receipt_id": "rcpt-green-001",
  "protocol_version": "1.2",
  "schema_version": "1.2.0-alpha",
  "policy_version": "aios-v1.2.0-alpha",
  "previous_event_id": null,
  "amendment_reference": null
}
